{
  "id": "go-04-concurrency",
  "courseId": "go",
  "chapterIndex": 4,
  "title": {
    "de": "4. Goroutines & Channels (Concurrency)",
    "en": "4. Goroutines & Channels (Concurrency)"
  },
  "description": {
    "de": "Meistere Go's CSP-Modell (Communicating Sequential Processes) mit leichtgewichtigen Goroutines und typsicheren Channels.",
    "en": "Master Go's CSP concurrency model (Communicating Sequential Processes) with lightweight goroutines and type-safe channels."
  },
  "sections": [
    {
      "id": "go-04-sec-01",
      "type": "concept",
      "title": { "de": "Goroutines starten", "en": "Starting Goroutines" },
      "contentMarkdown": {
        "de": "Eine Goroutine ist ein leichtgewichtiger Thread, der von der Go-Runtime verwaltet wird. Du startest jede beliebige Funktion asynchron mit dem Schlüsselwort `go`.",
        "en": "A goroutine is a lightweight thread managed by the Go runtime. You can run any function concurrently using the `go` keyword."
      },
      "codeSnippet": "go worker(taskID)\n\n// Goroutines teilen sich keinen Speicher über Locks,\n// sondern kommunizieren über Channels."
    },
    {
      "id": "go-04-sec-02",
      "type": "quiz_choice",
      "title": { "de": "Channel Initialisierung", "en": "Channel Initialization" },
      "prompt": {
        "de": "Wie initialisiert man einen ungebufferten Channel für String-Werte in Go?",
        "en": "How do you initialize an unbuffered channel for string values in Go?"
      },
      "options": [
        "ch := new(channel string)",
        "ch := make(chan string)",
        "var ch = channel<string>()",
        "ch := make(chan string, 10)"
      ],
      "solution": 1,
      "explanation": {
        "de": "`make(chan string)` erzeugt einen ungebufferten Channel. Erst die Angabe einer zweiten Kapazitätszahl wie `make(chan string, 10)` macht ihn gepuffert.",
        "en": "`make(chan string)` creates an unbuffered channel. Specifying a capacity like `make(chan string, 10)` creates a buffered channel."
      }
    },
    {
      "id": "go-04-sec-03",
      "type": "quiz_code_puzzle",
      "title": { "de": "Channel Kommunikation", "en": "Channel Communication" },
      "prompt": {
        "de": "Welcher Operator wird verwendet, um einen Wert in einen Channel zu senden bzw. daraus zu empfangen?",
        "en": "Which operator is used to send or receive values through a channel?"
      },
      "starterCode": "ch ___ \"done\" // Senden\nmsg := ___ ch // Empfangen",
      "options": ["<-", "->", "=>", ":="],
      "solution": "<-",
      "explanation": {
        "de": "Der Channel-Operator `<-` zeigt die Richtung des Datenflusses an: `ch <- val` sendet in den Channel, `val := <-ch` empfängt aus dem Channel.",
        "en": "The channel arrow `<-` indicates data flow direction: `ch <- val` sends into the channel, while `val := <-ch` receives from it."
      }
    }
  ]
}
